{
  "schema_version": "ISRAS-REPOSITORY-V1",
  "standard": {
    "name": "Iron Signal Repository Assurance Standard",
    "acronym": "ISRAS",
    "version": "1.0.1",
    "repository": "Iron-Signal-Systems/engineering-standards",
    "commit": "c379417720faa595fa5cb89a1dfdb2259d6cb95e",
    "definition": "The organization-wide repository reproducibility, validation, historical verification, evidence, acceptance, release, deployment verification, recovery, and maintenance standard for Iron Signal Systems."
  },
  "repository": "Iron-Signal-Systems/iron-atlas",
  "canonical_origin": "git@github.com:Iron-Signal-Systems/iron-atlas.git",
  "branches": {
    "development": "dev",
    "release": "main"
  },
  "profiles": [
    "go-documentation-generation"
  ],
  "validation": {
    "portable_shell": "./tools/validation/validate_portable.sh",
    "portable_powershell": "./tools/validation/Validate-Portable.ps1",
    "fresh_clone_shell": "./tools/validation/validate_fresh_clone.sh",
    "checkpoint_shell": "./tools/validation/validate_checkpoint.sh",
    "canonical_shell": "./tools/validation/validate_canonical.sh",
    "fresh_clone_powershell": "./tools/validation/Validate-FreshClone.ps1",
    "checkpoint_powershell": "./tools/validation/Validate-Checkpoint.ps1",
    "canonical_powershell": "./tools/validation/Validate-Canonical.ps1"
  },
  "checkpoint_registry": "tools/validation/checkpoints.json",
  "evidence_directory": "docs/acceptance/evidence",
  "source_manifest": "SOURCE-SHA256SUMS.txt",
  "tool_requirements": "tools/requirements.txt",
  "support_policy": "SUPPORT-AND-COMPATIBILITY.md",
  "documentation_sync_required": true,
  "historical_gates_immutable": true,
  "native_first": true,
  "containers_required": false,
  "direct_push_to_development_branch": false,
  "adoption_level": "RECORDED"
}
